{
  "$schema": "https://json-schema.org/draft/2020-12/schema",
  "$id": "https://raw.githubusercontent.com/yhay81/public-data-catalog/main/recipe.schema.json",
  "title": "Verified Public Data Retrieval Recipe",
  "type": "object",
  "additionalProperties": false,
  "required": [
    "$schema",
    "id",
    "contract_version",
    "title",
    "question",
    "source_id",
    "request",
    "expect",
    "result",
    "interpretation",
    "attribution",
    "last_verified"
  ],
  "properties": {
    "$schema": {"type": "string", "format": "uri-reference"},
    "id": {"type": "string", "pattern": "^[a-z0-9][a-z0-9-]+$"},
    "contract_version": {"type": "string", "pattern": "^[0-9]+\\.[0-9]+\\.[0-9]+$"},
    "title": {"$ref": "#/$defs/localized"},
    "question": {"$ref": "#/$defs/localized"},
    "source_id": {"type": "string", "pattern": "^[a-z0-9][a-z0-9-]+$"},
    "parameters": {
      "type": "object",
      "minProperties": 1,
      "additionalProperties": {"$ref": "#/$defs/parameter"}
    },
    "request": {
      "type": "object",
      "additionalProperties": false,
      "required": ["method", "url", "allowed_hosts"],
      "properties": {
        "method": {"const": "GET"},
        "url": {"type": "string", "format": "uri"},
        "allowed_hosts": {
          "type": "array",
          "items": {"type": "string", "minLength": 1},
          "minItems": 1,
          "uniqueItems": true
        },
        "headers": {
          "type": "object",
          "additionalProperties": false,
          "properties": {
            "Accept": {"type": "string", "minLength": 1}
          }
        },
        "bindings": {
          "type": "array",
          "minItems": 1,
          "items": {"$ref": "#/$defs/binding"}
        }
      }
    },
    "expect": {
      "type": "object",
      "additionalProperties": false,
      "required": ["status", "content_type_contains", "max_bytes", "assertions"],
      "properties": {
        "status": {"const": 200},
        "content_type_contains": {"type": "string", "minLength": 1},
        "max_bytes": {"type": "integer", "minimum": 1024, "maximum": 1000000},
        "assertions": {
          "type": "array",
          "minItems": 1,
          "items": {
            "type": "object",
            "additionalProperties": false,
            "required": ["pointer"],
            "properties": {
              "pointer": {"type": "string"},
              "equals": {},
              "equals_parameter": {"$ref": "#/$defs/parameterAssertion"},
              "minimum": {"type": "number"},
              "min_length": {"type": "integer", "minimum": 0}
            },
            "oneOf": [
              {"required": ["equals"]},
              {"required": ["equals_parameter"]},
              {"required": ["minimum"]},
              {"required": ["min_length"]}
            ]
          }
        }
      }
    },
    "result": {
      "type": "object",
      "additionalProperties": false,
      "required": ["fields"],
      "properties": {
        "fields": {
          "type": "array",
          "minItems": 1,
          "items": {"$ref": "#/$defs/resultField"}
        }
      }
    },
    "interpretation": {
      "type": "array",
      "items": {"type": "string", "minLength": 1},
      "minItems": 1
    },
    "attribution": {
      "type": "object",
      "additionalProperties": false,
      "required": ["source_url", "license_url", "credit"],
      "properties": {
        "source_url": {"type": "string", "format": "uri"},
        "license_url": {"type": "string", "format": "uri"},
        "credit": {"type": "string", "minLength": 1}
      }
    },
    "last_verified": {"type": "string", "format": "date"}
  },
  "$defs": {
    "localized": {
      "type": "object",
      "additionalProperties": false,
      "required": ["ja", "en"],
      "properties": {
        "ja": {"type": "string", "minLength": 1},
        "en": {"type": "string", "minLength": 1}
      }
    },
    "parameter": {
      "type": "object",
      "additionalProperties": false,
      "required": ["type", "description", "default", "minimum", "maximum"],
      "properties": {
        "type": {"const": "integer"},
        "description": {"$ref": "#/$defs/localized"},
        "default": {"type": "integer"},
        "minimum": {"type": "integer"},
        "maximum": {"type": "integer"}
      }
    },
    "binding": {
      "type": "object",
      "additionalProperties": false,
      "required": ["parameter", "location", "name", "format"],
      "properties": {
        "parameter": {"type": "string", "pattern": "^[a-z0-9][a-z0-9-]+$"},
        "location": {"const": "query"},
        "name": {"type": "string", "pattern": "^[A-Za-z][A-Za-z0-9_-]*$"},
        "format": {
          "type": "string",
          "pattern": "^[A-Za-z0-9._~-]*\\{value\\}[A-Za-z0-9._~-]*$"
        }
      }
    },
    "parameterAssertion": {
      "type": "object",
      "additionalProperties": false,
      "required": ["parameter", "format"],
      "properties": {
        "parameter": {"type": "string", "pattern": "^[a-z0-9][a-z0-9-]+$"},
        "format": {
          "type": "string",
          "pattern": "^[A-Za-z0-9._~-]*\\{value\\}[A-Za-z0-9._~-]*$"
        }
      }
    },
    "resultField": {
      "type": "object",
      "additionalProperties": false,
      "required": ["name", "label", "pointer"],
      "properties": {
        "name": {"type": "string", "pattern": "^[a-z0-9][a-z0-9-]+$"},
        "label": {"$ref": "#/$defs/localized"},
        "pointer": {"type": "string"},
        "unit": {"type": "string", "minLength": 1},
        "description": {"type": "string", "minLength": 1},
        "transform": {
          "type": "string",
          "enum": ["integer", "number", "string", "unix_milliseconds_to_iso8601"]
        }
      }
    }
  }
}
